{
  "schemaVersion": 1,
  "kind": "ra.event",
  "eventId": "raev-0123456789abcd05",
  "idempotencyKey": "raev-0123456789abcd05",
  "occurredAt": "2026-08-11T12:05:00Z",
  "account": {
    "reference": "ra-acct-0123456789ab",
    "authState": "configured",
    "credentialRef": "keyring:steamzero/retroachievements/v1"
  },
  "game": {
    "recognition": "recognized",
    "romHash": {
      "algorithm": "sha256",
      "digest": "0123456789abcdef0123456789abcdef0123456789abcdef0123456789abcdef"
    },
    "titleId": "ra-game-012345"
  },
  "achievement": {"id": "ra-ach-0046", "title": "Passo offline"},
  "state": "pending-sync",
  "outbox": {
    "entryId": "ra-ob-0123456789ab",
    "queuedAt": "2026-08-11T12:05:00Z",
    "retryCount": 0,
    "maxRetries": 10
  }
}
